[
  {
    "id": "leagues-of-votann",
    "name": "Leagues of Votann",
    "parent_faction_id": null,
    "game_version": {
      "edition": "11th",
      "dataslate": "pre-launch-provisional"
    },
    "keywords": [
      "Leagues of Votann"
    ],
    "aliases": [],
    "logo_url": "https://cdn.jsdelivr.net/gh/Certseeds/wh40k-icon@be230023ff0755d19ffb1a1762658c711c2887f9/src/svgs/xenos/leagues-of-votann.svg",
    "external_refs": [
      {
        "namespace": "game-datacards",
        "id": "a42808ab-f00b-4664-aed5-8d9341b96e36"
      },
      {
        "namespace": "mfm",
        "id": "a42808ab-f00b-4664-aed5-8d9341b96e36"
      }
    ],
    "faction_rule_ids": [
      "prioritised-efficiency-leagues-of-votann"
    ]
  }
]
