[
  {
    "id": "adeptus-custodes",
    "name": "Adeptus Custodes",
    "parent_faction_id": null,
    "game_version": {
      "edition": "11th",
      "dataslate": "pre-launch-provisional"
    },
    "keywords": [
      "Imperium",
      "Adeptus Custodes"
    ],
    "aliases": [],
    "logo_url": "https://cdn.jsdelivr.net/gh/Certseeds/wh40k-icon@be230023ff0755d19ffb1a1762658c711c2887f9/src/svgs/human_imperium/adeptus-custodes.svg",
    "external_refs": [
      {
        "namespace": "game-datacards",
        "id": "6cc4ee5e-3bc6-4142-8147-2e1a9fb6e82c"
      },
      {
        "namespace": "mfm",
        "id": "6cc4ee5e-3bc6-4142-8147-2e1a9fb6e82c"
      }
    ],
    "faction_rule_ids": [
      "aegis-of-the-emperor-adeptus-custodes",
      "aquila-commander-adeptus-custodes",
      "daughters-of-the-abyss-adeptus-custodes",
      "martial-katah-adeptus-custodes",
      "special-move-types-adeptus-custodes"
    ]
  }
]
