[
  {
    "id": "orks",
    "name": "Orks",
    "parent_faction_id": null,
    "game_version": {
      "edition": "11th",
      "dataslate": "pre-launch-provisional"
    },
    "keywords": [
      "Orks"
    ],
    "aliases": [],
    "logo_url": "https://cdn.jsdelivr.net/gh/Certseeds/wh40k-icon@be230023ff0755d19ffb1a1762658c711c2887f9/src/svgs/xenos/orks/orks.svg",
    "external_refs": [
      {
        "namespace": "game-datacards",
        "id": "0b30f1e3-1e5c-4823-afa1-07951433a270"
      },
      {
        "namespace": "mfm",
        "id": "0b30f1e3-1e5c-4823-afa1-07951433a270"
      }
    ],
    "faction_rule_ids": [
      "waaagh-orks",
      "da-boss-orks",
      "unstable-energies-orks",
      "special-move-types-orks"
    ]
  }
]
